{
  "$schema": "https://json-schema.org/draft/2020-12/schema",
  "$id": "https://raw.githubusercontent.com/jeremiah-k/medre/main/docs/schemas/delivery-result.schema.json",
  "title": "AdapterHandoffResult",
  "description": "Immutable fact returned by an adapter after a successful synchronous hand-off. It describes how far MEDRE reached the transport boundary; it is not durable lifecycle authority and does not claim recipient delivery.",
  "type": "object",
  "properties": {
    "disposition": {
      "type": "string",
      "enum": ["transport_handoff", "deferred"],
      "default": "transport_handoff",
      "description": "Synchronous hand-off disposition. 'transport_handoff' means the adapter reached its external transport boundary during deliver(); 'deferred' means work was accepted locally and later facts arrive through DeliveryFeedback."
    },
    "native_message_id": {
      "type": ["string", "null"],
      "default": null,
      "description": "Platform-native message ID when known at synchronous hand-off. Deferred results cannot claim one.",
      "minLength": 1,
      "pattern": ".*\\S.*"
    },
    "native_channel_id": {
      "type": ["string", "null"],
      "default": null,
      "description": "Platform-resolved native channel/room/conversation ID when supplied by the transport. This is evidence, not route identity.",
      "minLength": 1,
      "pattern": ".*\\S.*"
    },
    "native_thread_id": {
      "type": ["string", "null"],
      "default": null,
      "description": "Platform-native thread or parent identifier when supplied by the transport.",
      "minLength": 1,
      "pattern": ".*\\S.*"
    },
    "native_relation_id": {
      "type": ["string", "null"],
      "default": null,
      "description": "Platform-native related-entity identifier when supplied by the transport.",
      "minLength": 1,
      "pattern": ".*\\S.*"
    },
    "confirmation_level": {
      "type": "string",
      "enum": [
        "unknown",
        "local_queue",
        "local_transport",
        "remote_service",
        "end_to_end"
      ],
      "default": "unknown",
      "description": "Strongest transport fact proven by the hand-off, independent of durable delivery lifecycle status."
    },
    "note": {
      "type": "string",
      "default": "",
      "description": "Human-readable hand-off context. Informational only and never lifecycle authority."
    },
    "metadata": {
      "type": "object",
      "propertyNames": {
        "not": {
          "enum": [
            "kind",
            "attempt_provenance",
            "handoff",
            "disposition",
            "outcome",
            "confirmation_level",
            "native_message_id",
            "native_channel_id",
            "native_thread_id",
            "native_relation_id",
            "note",
            "status",
            "state",
            "error",
            "event_id",
            "delivery_plan_id",
            "target_adapter",
            "target_channel",
            "outbox_id",
            "attempt_number",
            "source",
            "replay_run_id"
          ]
        }
      },
      "additionalProperties": true,
      "default": {},
      "description": "Deeply immutable, JSON-safe, namespaced hand-off metadata. Transport-specific data SHOULD live under metadata[<transport>]."
    }
  },
  "additionalProperties": false,
  "allOf": [
    {
      "if": {
        "properties": {
          "disposition": {
            "const": "deferred"
          }
        },
        "required": ["disposition"]
      },
      "then": {
        "properties": {
          "native_message_id": {
            "type": "null"
          },
          "confirmation_level": {
            "enum": ["unknown", "local_queue"]
          }
        }
      }
    }
  ]
}
